{
  "schema_version": 1,
  "id": "two_floor_manor_vanilla_detail",
  "name": "Two Floor Manor ? Vanilla Detail Complete",
  "facade_profile": "classic_manor",
  "modules": [
    {
      "id": "hall",
      "source": "composition/detailed_examples/grand_hall_detail_complete.source.json",
      "origin": [
        20,
        0,
        20
      ],
      "ports": [
        {
          "id": "upper",
          "side": "up",
          "pos": [
            30,
            23,
            24
          ],
          "width": 5,
          "height": 1,
          "depth": 5
        }
      ]
    },
    {
      "id": "upper_suite",
      "source": "composition/detailed_examples/bedroom_detail_complete.source.json",
      "ports": [
        {
          "id": "down",
          "side": "down",
          "pos": [
            15,
            0,
            13
          ],
          "width": 5,
          "height": 1,
          "depth": 5
        }
      ]
    }
  ],
  "connections": [
    {
      "from": [
        "hall",
        "upper"
      ],
      "to": [
        "upper_suite",
        "down"
      ],
      "mode": "attach",
      "width": 5,
      "height": 1
    }
  ],
  "roof": {
    "enabled": true,
    "style": "gable",
    "state": "minecraft:spruce_planks",
    "gable_state": "minecraft:stone_bricks",
    "step_run": 2,
    "overhang": 1,
    "module_overrides": {
      "hall": {
        "style": "none"
      }
    }
  },
  "site": {
    "enabled": false
  },
  "vanilla_finish": {
    "enabled": true,
    "seed": 19001
  }
}
