{
  "schema_version": 1,
  "id": "style_finish_gothic",
  "name": "Style Finish - Gothic",
  "facade_profile": "massive_gothic_manor",
  "modules": [
    {
      "id": "room",
      "source": "composition/detailed_examples/bedroom_detail_complete.source.json",
      "origin": [
        0,
        0,
        0
      ]
    }
  ],
  "connections": [],
  "site": {
    "enabled": false
  },
  "vanilla_finish": {
    "enabled": true,
    "seed": 21005
  },
  "style_finish": {
    "enabled": true,
    "seed": 21105
  }
}
